,Name,address,pincode,website,phone number,scrap
2028,Sri Krishna Priya Goshala,"CH95+5GV, beside balaji enclave, North Kalyanpuri, Mallikarjuna Nagar, Uppal, Secunderabad, Hyderabad, Telangana 500039",500039,,093469 24787,500002
2029,Goshala - Ch.Shiva Math,"FCCM+GQV, Medak - Hyderabad Rd, Kukatpally Industrial Estate, Balanagar, Hyderabad, Telangana 500037",500037,, ,500002
2030,Goshala,"Plot No. 111 & 112, North Kalyanpuri, Mallikarjuna Nagar, Uppal, Hyderabad, Telangana 500039",500039,, ,500002
2031,Shri Krishna Gau Shala,"14-10-857, Jungoor Basthi, Dhoolpet, Hyderabad, Telangana 500006",500006,, ,500002
2032,Veera Hanuman Ghoshala,"H-21-62, Sriram Nagar, Jeedimetla, Hyderabad, Telangana 500055",500055,, ,500002
2033,Gaushala,"G9FQ+C36, Vasanth Nagar Colony, Nizampet, Hyderabad, Telangana 500090",500090,, ,500002
2034,ISKCON VKGT Goshala - Pure Cow Milk,"ISKCON Temple Campus Dabilpur Village, Medchal, Hyderabad, Telangana 501401",501401,http://www.iskconmedchal.org/,096547 89832,500002
2035,Shree Gaushala,"9FGP+HVC, KALIKHABER, Chaderghat, Hyderabad, Telangana 500024",500024, , ,500002
2036,Sri Radha Krishna Mandir & goshala,"Pochamma, temple, Gokul Nagar Rd, Gokul Nagar, A. S. Rao Nagar, Secunderabad, Telangana 500062",500062,, ,500062
2037,Sri Krishna Priya Goshala,"CH95+5GV, beside balaji enclave, North Kalyanpuri, Mallikarjuna Nagar, Uppal, Secunderabad, Hyderabad, Telangana 500039",500039,,093469 24787,500062
2038,"Jain mandir, Gosaala","FG6V+G32, Aymaan Mansion Rd, Surya nagar, Sai Raja Enclave, Safilguda, Malkajgiri, Secunderabad, Telangana 500056",500056,, ,500062
2039,gosala desi gos,"Vayushakti Nagar, P S Rao Nagar, Dammaiguda, Hyderabad, Secunderabad, Telangana 500083",500083,https://www.youtube.com/c/PaniniPrabhatKanyaMahaVidyalayam,080743 25521,500062
2040,Gowshala,"54, 1-2-607, Besides old DBR Mills, 8, Lower Tank Bund St, SBH Officers Colony, Lower Tank Bund, Kavadiguda, Hyderabad, Telangana 500080",500080,,1800 4254 6464,500062
2041,Goshala,"Plot No. 111 & 112, North Kalyanpuri, Mallikarjuna Nagar, Uppal, Hyderabad, Telangana 500039",500039,, ,500062
2042,ISKCON VKGT Goshala - Pure Cow Milk,"ISKCON Temple Campus Dabilpur Village, Medchal, Hyderabad, Telangana 501401",501401,http://www.iskconmedchal.org/,096547 89832,500062
2043,Devikanandan Gaushala,"MF3C+GX6, Unnamed Road, Medchal, Secunderabad, Telangana 501401",501401,, ,500062
2044,Sri Krishna Goshala,"Power Welfare Society, Narsingi, Kokapet, Hyderabad, Telangana 500075",500075,,1800 4254 6464,500062
2045,Veera Hanuman Ghoshala,"H-21-62, Sriram Nagar, Jeedimetla, Hyderabad, Telangana 500055",500055,, ,500062
2046,Gopthri Desi Goshala,"FMM7+PV2, Bandlaguda, Secunderabad, Telangana 501301",501301,, ,500062
2047,ISKCON goshala,"7788+R78, Kondaveedu, Havusuganesa, Andhra Pradesh 522529",522529,, ,522006
2048,Guntur Gaushala,"8F43+F3R, Butchaiah Thota, Nehru Nagar, Guntur, Andhra Pradesh 522001",522001,, ,522006
2049,Murali Goshala,"CF95+7HX, Tadikonda, Andhra Pradesh 522236",522236,, ,522006
2050,Goshala,"76-8-6/3, Swathi Theatre Rd, opp. andhra bank, Housing Board Colony, Vijayawada, Andhra Pradesh 520012",520012,, ,522006
2051,Gogineni Sambasivarao Dairy Farm,"8CFG+JVQ, Vidya Nagar, Vidyanagar, Guntur, Andhra Pradesh 522007",522007,, ,522006
2052,Go Samrakshana Sangam,"522001, Butchaiah Thota, Nehru Nagar, Guntur, Andhra Pradesh 522001",522001,,0863 224 3111,522006
2053,Kamadhenuvu Gosala.,"892P+HG8, Nallapadu Katta Road, Nallapadu, Andhra Pradesh 522005",522005,, ,522006
2054,Nadipathy Goshala,"Yrc Canal Road, Yeleswaram, Vanthada, Andhra Pradesh 533429",533429,http://www.nadipathygoshala.com/,088850 11326,522006
2055,Vasudeva Goshala,"Dr.No.24/137, Five Road Centre, Chakirevu Palem, Machilipatnam, Andhra Pradesh 521001",521001,,086722 23545,522006
2056,Govindan Goshala,"68,Goodalur Village, Madurantakam, Taluk, Guddalur, Tamil Nadu 603306",603306,http://goseva.net/aboutgovindan.aspx,044 2489 9926,522006
2057,Gosala Sujeeth,"7CMF+V6P, Guntur, Andhra Pradesh 522004",522004,, ,522006
2058,Gaushala,"G5CC+29G, Teacher Colony, Vasant Kunj, New Delhi, Delhi 110070",110070,, ,110067
2059,Mehrauli Gaushala,"G59C+Q9Q, Kishangarh, Teacher Colony, Vasant Kunj, New Delhi, Delhi 110070",110070,, ,110067
2060,Gaushala,"G5RQ+CQX, Phase 1, Block C, Katwaria Sarai, New Delhi, Delhi 110016",110016,, ,110067
2061,Guru Gorakh Nath Gaushala,"Ram Talab Mandir, Block A, Qutab Institutional Area, New Delhi, Delhi 110016",110016,, ,110067
2062,R k puram gaau sala,"H53J+WW7, Sector 3, Rama Krishna Puram, New Delhi, Delhi 110022",110022,, ,110067
2063,Nandi Dham Gaushala,"F2WF+F4H, Carterpuri Rd, Ashok Vihar Phase III Extension, Gurugram, Haryana 122001",122001,, ,110067
2064,Gauseva Foundation,"9, Block, A-8, Block A, Vasant Vihar, New Delhi, Delhi 110057",110057,http://www.gauseva.co.in/,097794 67794,110067
2065,Meer house 4E/9 kishangarh gaushala chowk,"9, Kishangarh, Teacher Colony, Mehrauli, New Delhi, Delhi 110070",110070,, ,110067
2066,Mughal Darbar in Kishan Garh near Gaushala,"266e/1, Garhwal Colony, Teacher Colony, Mehrauli, New Delhi, Delhi 110070",110070, , ,110067
2067,Gaushala Kishangarh,"Pocket 1, Sector B, Vasant Kunj, New Delhi, Delhi 110070",110070,, ,110067
2068,Ganga Feed Shop ( Gaushala mehrauli dehat ),"H no 62, G/F, Kishangarh - Gaushala Marg, Teacher Colony, Mehrauli, New Delhi, Delhi 110070",110070,, ,110067
2069,Shri Krishan Gaushala,"Sultanpur Dabas, kanjhawala, road, Bawana, Delhi 110039",110039,https://www.shrikrishangaushala.org/history/, ,110067
2070,Shiv Mandir Kishan Garh,"111, 9, Kishangarh - Gaushala Marg, Kishangarh Village, Lakhi Nath Kuti, Vasant Kunj, New Delhi, Delhi 110070",110070,,098110 31658,110067
2071,Himasthalee Gaushala & Panchagavya Chikitsa Seva Kendra,"J5PV+7FX, Subal, West Bengal 734426",734426,, ,734426
2072,Shri Darjeeling Siliguri Gaushala,"PC2F+GW4, East Milanpally, Siliguri, West Bengal 734004",734004,, ,734426
2073,Shri Darjeeling Siliguri Gaushala,"PC2F+GW4, East Milanpally, Siliguri, West Bengal 734004",734004,, ,734010
2074,Babupara Goshala,"PC2F+9MV, East Milanpally, Babupara, Siliguri, West Bengal 734004",734004,, ,734010
2075,Goushala,"36, 36, Shiv Mandir Rd, Ward 13, Shibrampally, Siliguri, West Bengal 734001",734001,, ,734010
2076,Goshala godown,"PC27+F6V, Ward 5, Saktigarh, Siliguri, West Bengal 734005",734005,, ,734010
2077,Shri Darjeeling Siliguri Gaushala,"PC2F+GW4, East Milanpally, Siliguri, West Bengal 734004",734004,, ,734009
2078,Babupara Goshala,"PC2F+9MV, East Milanpally, Babupara, Siliguri, West Bengal 734004",734004,, ,734009
2079,Goushala,"36, 36, Shiv Mandir Rd, Ward 13, Shibrampally, Siliguri, West Bengal 734001",734001,, ,734009
2080,Goshala godown,"PC27+F6V, Ward 5, Saktigarh, Siliguri, West Bengal 734005",734005,, ,734009
2081,Govind Gaushala,"692R+W5, Kheri Chittam, Uttar Pradesh 250622",250622,, ,251309
2082,Gaushala,"F836+25G, Pansaariyan, Shamli, Uttar Pradesh 247776",247776,, ,251309
2083,KANHA GAUSHALA HARRA,"Harra, Harar, Uttar Pradesh 250344",250344,, ,251309
2084,Gaushala,"C8XJ+GR, Shamli, Uttar Pradesh 247776",247776,, ,251309
2085,Gaushala Babri,"FCJM+9W9, Babri, Uttar Pradesh 251301",251301,, ,251309
2086,"Gaushala, Atali, Moz, UP","Road, Dholra, Uttar Pradesh 251301",251301,, ,251309
2087,"Gayatri Shaktipeeth And Surabhi Gaushala, Kaithawari","3F6J+585, Kaithwara, Kaithwari, Uttar Pradesh 250502",250502,, ,251309
2088,Gaushala Banat गौशाला बनत,"C9X2+C6, Sainhra, Uttar Pradesh 247776",247776,, ,251309
2089,Gaushala,"FMFM+8X9, Niyazupura, Muzaffarnagar, Uttar Pradesh 251002",251002,, ,251311
2090,Gaushala sabha,"GAUSHALA MARKET OPPT GARBI SCHOOL, Bhagat Singh Rd, Niyazupura, Muzaffarnagar, Uttar Pradesh 251002",251002,, ,251311
2091,Gaushala Nadi road,"109/35, Gaushala Nadi Rd, Sutharshahi, Muzaffarnagar, Uttar Pradesh 251002",251002,, ,251311
2092,"Gaushala, Atali, Moz, UP","Road, Dholra, Uttar Pradesh 251301",251301,, ,251311
2093,Gaushala,"FMFM+8X9, Niyazupura, Muzaffarnagar, Uttar Pradesh 251002",251002,, ,251003
2094,Gaushala sabha,"GAUSHALA MARKET OPPT GARBI SCHOOL, Bhagat Singh Rd, Niyazupura, Muzaffarnagar, Uttar Pradesh 251002",251002,, ,251003
2095,Gaushala Nadi road,"109/35, Gaushala Nadi Rd, Sutharshahi, Muzaffarnagar, Uttar Pradesh 251002",251002,, ,251003
2096,GOSHALA,"JC8X+Q9F, Samsaam Ullah Afridi Road, Umerpur, Uttar Pradesh 247772",247772,,095577 77653,247772
2097,Gaushala,"FMFM+8X9, Niyazupura, Muzaffarnagar, Uttar Pradesh 251002",251002,, ,247772
2098,"Gaushala, Atali, Moz, UP","Road, Dholra, Uttar Pradesh 251301",251301,, ,247772
2099,Gaushala Babri,"FCJM+9W9, Babri, Uttar Pradesh 251301",251301,, ,247772
2100,Gaushala,"FMFM+8X9, Niyazupura, Muzaffarnagar, Uttar Pradesh 251002",251002,, ,251314
2101,Pt chhajuram alokik gaushala religious trust,"73X4+55P, Rd, Ramraj, Chakarsainpur, Uttar Pradesh 251315",251315,, ,251314
2102,Ekta Goshala,"Near River, Jansath, Kamhera, Uttar Pradesh 251314",251314, , ,251314
2103,Gaushala,"F836+25G, Pansaariyan, Shamli, Uttar Pradesh 247776",247776,, ,247774
2104,Gaushala,"C8XJ+GR, Shamli, Uttar Pradesh 247776",247776,, ,247774
2105,Gaushala,"FMFM+8X9, Niyazupura, Muzaffarnagar, Uttar Pradesh 251002",251002,, ,247774
2106,Mayapur Farm & Dairy,"Mayapur Farm, Kairana, Uttar Pradesh 247774",247774,http://www.mayapurfarm.com/,098997 32479,247774
2107,Shree Krishna Gaushala Adhmi (Regd. No.00655),"84R5+JGM, Adhmi Rd, Jalmana, Haryana 132103",132103,, ,247774
2108,Gaushala Banat गौशाला बनत,"C9X2+C6, Sainhra, Uttar Pradesh 247776",247776,, ,247774
2109,Gausala badarkha,"Yamuna Rd, Badarkha, Uttar Pradesh 250617",250617,, ,247774
2110,Radha Surabhi Goshala,"GFMV+239, Uttar Pradesh 281504",281504,http://www.radhasurabhi.com/,099276 68182,247774
2111,Mahipal General Store,"Gaushala Rd, Shamli, Uttar Pradesh 247774",247774,,087914 52655,247774
2112,Salman Edition Home,"near Gaushala, Begumpura, Kairana, Kairanaa Rural, Uttar Pradesh 247774",247774,, ,247774
2113,Gaushala,"F836+25G, Pansaariyan, Shamli, Uttar Pradesh 247776",247776,, ,247775
2114,Gaushala,"C8XJ+GR, Shamli, Uttar Pradesh 247776",247776,, ,247775
2115,Gaushala,"FMFM+8X9, Niyazupura, Muzaffarnagar, Uttar Pradesh 251002",251002,, ,247775
2116,Govind Gaushala,"692R+W5, Kheri Chittam, Uttar Pradesh 250622",250622,, ,247775
2117,Shree Krishna Gaushala Adhmi (Regd. No.00655),"84R5+JGM, Adhmi Rd, Jalmana, Haryana 132103",132103,, ,247775
2118,Kiwana Gaushala,"982G+3W5, Kiwana, Uttar Pradesh 247775",247775, , ,247775
2119,Gaushala,"FMFM+8X9, Niyazupura, Muzaffarnagar, Uttar Pradesh 251002",251002,, ,251201
2120,Gaushala,"5MXC+647, Unnamed Road, Kapsarh, Uttar Pradesh 250223",250223,, ,251201
2121,Ekta Goshala,"Near River, Jansath, Kamhera, Uttar Pradesh 251314",251314, , ,251201
2122,ब्रह्मऋषि कृष्णदत्त गौशाला / Kakkepur Gaushala,"Kakkepur, Uttar Pradesh 250344",250344,, ,251201
2123,KANHA GAUSHALA HARRA,"Harra, Harar, Uttar Pradesh 250344",250344,, ,251201
2124,Vedic Gaushala & Research Center,"5P35+8RH, Nagli Mazra Mataur, Uttar Pradesh 250221",250221,, ,251201
2125,Govind Gaushala,"692R+W5, Kheri Chittam, Uttar Pradesh 250622",250622,, ,251201
2126,Gaushala Chhachhrauli,"69X7+5PX, Haryana 135001",135001,, ,251201
2127,Sureshwari Gopeeth Gaushala,"Amolik Enclave, Khirwa Rd, Nangla Tashi, Meerut, Uttar Pradesh 250341",250341,https://www.instagram.com/sureshwarigaupeeth?igsh=MTgyeThycWFoNXQ4aQ==, ,251201
2128,GAUSHALA,"Gaushala Rd, Ram Jivan Nagar, Saharanpur, Uttar Pradesh 247001",247001, , ,251201
2129,Prabhuji Ka Parivaar Gaushala,"WGMM+843, SH 57, Rohit Vihar, Saharanpur, Chiruki, Uttar Pradesh 247001",247001,http://www.facebook.com/prabhujikaparivaar,0132 651 6555,251201
2130,Mata Bhagwati Gaushala,"Dev Sanskriti Vishwavidyalaya, Haripur Kalan, Haridwar, Motichur Range, Uttarakhand 249411",249411,http://www.dsvv.ac.in/, ,251201
2131,Radha Surabhi Goshala,"GFMV+239, Uttar Pradesh 281504",281504,http://www.radhasurabhi.com/,099276 68182,251201
2132,Shri Krishna Gaushala,"Near, behind Jwalapur Railway Station Road, Jamalpur Kalan, Jwalapur, Haridwar, Uttarakhand 249407",249407,, ,251201
2133,Gausala badarkha,"Yamuna Rd, Badarkha, Uttar Pradesh 250617",250617,, ,251201
2134,Aai ji gowshala,"GJJ2+77Q, Malkaram Rd, Jawahar Nagar, Shamirpet, Hyderabad, Secunderabad, Telangana 501301",501301,,099516 48123,500083
2135,Hindu seve samithi GOSHALA,"GH6C+W4V, Jawahar Nagar, Sainikpuri, Hyderabad, Secunderabad, Telangana 500094",500094,, ,500083
2136,gosala desi gos,"Vayushakti Nagar, P S Rao Nagar, Dammaiguda, Hyderabad, Secunderabad, Telangana 500083",500083,https://www.youtube.com/c/PaniniPrabhatKanyaMahaVidyalayam,080743 25521,500083
2137,Gowshala,"54, 1-2-607, Besides old DBR Mills, 8, Lower Tank Bund St, SBH Officers Colony, Lower Tank Bund, Kavadiguda, Hyderabad, Telangana 500080",500080,,1800 4254 6464,500083
2138,Sri Krishna Goshala,"Power Welfare Society, Narsingi, Kokapet, Hyderabad, Telangana 500075",500075,,1800 4254 6464,500083
2139,Sri Krishna Priya Goshala,"CH95+5GV, beside balaji enclave, North Kalyanpuri, Mallikarjuna Nagar, Uppal, Secunderabad, Hyderabad, Telangana 500039",500039,,093469 24787,500083
2140,Goshala - Ch.Shiva Math,"FCCM+GQV, Medak - Hyderabad Rd, Kukatpally Industrial Estate, Balanagar, Hyderabad, Telangana 500037",500037,, ,500083
2141,ISKCON VKGT Goshala - Pure Cow Milk,"ISKCON Temple Campus Dabilpur Village, Medchal, Hyderabad, Telangana 501401",501401,http://www.iskconmedchal.org/,096547 89832,500083
2142,Veera Hanuman Ghoshala,"H-21-62, Sriram Nagar, Jeedimetla, Hyderabad, Telangana 500055",500055,, ,500083
2143,Goshala,"Plot No. 111 & 112, North Kalyanpuri, Mallikarjuna Nagar, Uppal, Hyderabad, Telangana 500039",500039,, ,500083
2144,Sri Gopal Goshala,"6MP6+8P4, Naganpally, Telangana 501510",501510,, ,500083
2145,Desi Goshala,"GJFH+XC4, Road No. 10, Chiryala Village, Cheeriyal, Secunderabad, Telangana 501301",501301,, ,500083
2146,"Goshala, Swaana, smashana vatika","FJCH+7R3 Kumar swamy, Rampally, Secunderabad, Telangana 501301",501301,, ,500083
2147,Gaushala,"G9FQ+C36, Vasanth Nagar Colony, Nizampet, Hyderabad, Telangana 500090",500090,, ,500083
2148,Panini prabhat kanya maha vidyalaya and goshala,"Phase 2, P S Rao Nagar, Dammaiguda, Secunderabad, Telangana 500083",500083,https://www.youtube.com/c/PaniniPrabhatKanyaMahaVidyalayam,080743 25521,500083
2149,Sri Renuka Ellammathali Goshala,"Chanikyapuri Colony, Chandrapuri Colony, Mallapur, Secunderabad, Telangana 500076",500076,, ,500083
2150,Desi Goshala దేశీ గోశాల,"FJM3+M9V, Babu Reddy Nagar Rd, Shilpa Nagar, Nagaram, Secunderabad, Telangana 500083",500083, , ,500083
2151,Mayapur Goshala,"C9CV+93G, Mayapur, West Bengal 741302",741302,https://www.mayapur.com/visit-mayapur/places-to-visit/goshala/,1800 212 1655,741302
2152,ISKCON Mayapur Goshala Grazing Ground,"C9CW+V25, Mayapur, West Bengal 741302",741302,, ,741302
2153,Mayapur Goshala, ,741302, , ,741302
2154,Dham Goshala,"C982+77J, Srirampur Rd, North Srirampur, Nabadwip, West Bengal 741316",741316,, ,741302
2155,Kapil Kutir Sankhyo-Yog Ashram o Goshala,"C8QG+G4J, Bhandartikuri, West Bengal 741316",741316,, ,741302
2156,শ্রী মায়াপুর গোশালা,"C9CV+F6H, Mayapur, West Bengal 741302",741302,, ,741302
2157,Goshala stall,"C9GR+JFM, Mayapur, West Bengal 741313",741313, , ,741302
2158,Raniganj Gaushala (Kolkata Pinjrapole Society,"Near, Hatia Talaw, Raniganj, West Bengal 713347",713347,,0341 244 4759,741156
2159,Mayapur Goshala,"C9CV+93G, Mayapur, West Bengal 741302",741302,https://www.mayapur.com/visit-mayapur/places-to-visit/goshala/,1800 212 1655,741156
2160,Asansol Gaushala,"MXJF+P5F, Pathak Bari, Asansol, West Bengal 713301",713301,, ,741156
2161,Dham Goshala,"C982+77J, Srirampur Rd, North Srirampur, Nabadwip, West Bengal 741316",741316,, ,741316
2162,Mayapur Goshala,"C9CV+93G, Mayapur, West Bengal 741302",741302,https://www.mayapur.com/visit-mayapur/places-to-visit/goshala/,1800 212 1655,741316
2163,ISKCON Mayapur Goshala Grazing Ground,"C9CW+V25, Mayapur, West Bengal 741302",741302,, ,741316
2164,Mayapur Goshala, ,741316, , ,741316
2165,Kapil Kutir Sankhyo-Yog Ashram o Goshala,"C8QG+G4J, Bhandartikuri, West Bengal 741316",741316,, ,741316
2166,Mayapur Goshala,"C9CV+93G, Mayapur, West Bengal 741302",741302,https://www.mayapur.com/visit-mayapur/places-to-visit/goshala/,1800 212 1655,741315
2167,Mayapur Goshala, ,741315, , ,741315
2168,ISKCON Mayapur Goshala Grazing Ground,"C9CW+V25, Mayapur, West Bengal 741302",741302,, ,741315
2169,Sri Laxmi-Narsingha Goshala,"9CPV+H8P, Nrisingha Palli, SH 8, Krishnanagar, Subarna Behar, West Bengal 741103",741103,https://scsmathworldwide.com/goshala.html, ,741315
2170,SHYAMDAS MAHARAJ GOSHALA,"CC7J+7HV, Subarna Behar, West Bengal 741315",741315,, ,741315
2171,Dayodaya Gaushala,"XF4H+7P9, Mohun Bagan Ln, West Bengal 741250",741250,, ,741222
2172,Cow shed,"XG4J+QPR, Haringhata Farm Rd, Haringhata Farm, West Bengal 741252",741252,, ,741222
2173,Gosala Ground Sodepur,"P94J+8WV, Sodepur Rd, Mati Nagar, Rahara, Khardaha, West Bengal 700114",700114,, ,741222
2174,Calcutta Pinjrapole Society - Kalyani,"XF8J+48H, West Bengal 741234",741234,, ,741222
2175,Gaushala,"FMFM+8X9, Niyazupura, Muzaffarnagar, Uttar Pradesh 251002",251002,, ,251203
2176,"Radhe Shyam Gaushala, Muzaffarnagar","Ram Vihar, Bhopa Rd, near Evan Multispeciality Hospital, Muzaffarnagar, Uttar Pradesh 251001",251001,, ,251203
2177,Gaushala sabha,"GAUSHALA MARKET OPPT GARBI SCHOOL, Bhagat Singh Rd, Niyazupura, Muzaffarnagar, Uttar Pradesh 251002",251002,, ,251203
2178,Radha Surabhi Goshala,"GFMV+239, Uttar Pradesh 281504",281504,http://www.radhasurabhi.com/,099276 68182,251203
2179,Mandir,"95-B, Gaushala Rd, Gher Khatti, New Mandi, Muzaffarnagar, Uttar Pradesh 251001",251001,, ,251203
2180,SHREE BALAJI CORE,"FP96+GJQ, Gaushala Rd, New Mandi, Muzaffarnagar, Uttar Pradesh 251002",251002,, ,251203
2181,Gaushala,"FMFM+8X9, Niyazupura, Muzaffarnagar, Uttar Pradesh 251002",251002,, ,251315
2182,Pt chhajuram alokik gaushala religious trust,"73X4+55P, Rd, Ramraj, Chakarsainpur, Uttar Pradesh 251315",251315,, ,251315
2183,shree ram gaushala dairy Products Shop,"Aawas Vikas, Bijnor, Uttar Pradesh 246701",246701,,099275 25219,251315
2184,Nandni Gaudham,"8283+JR3, Alampur, Uttar Pradesh 251315",251315,, ,251315
2185,Ekta Goshala,"Near River, Jansath, Kamhera, Uttar Pradesh 251314",251314, , ,251315
2186,THE MUZAFFARNAGAR NEW MANDI GAUSHALA,"FXPQ+PJ3, Shukratal, Uttar Pradesh 251316",251316,, ,251316
2187,Gaushala,"FMFM+8X9, Niyazupura, Muzaffarnagar, Uttar Pradesh 251002",251002,, ,251316
2188,KAANHA GOSHALA,"GW2P+CFP, Bhokarhedi, Uttar Pradesh 251316",251316,, ,251316
2189,Shri parmdham gaushala,"C2J7+VF, Jalalpur Behra, Uttar Pradesh 246721",246721,, ,251316
2190,Pt chhajuram alokik gaushala religious trust,"73X4+55P, Rd, Ramraj, Chakarsainpur, Uttar Pradesh 251315",251315,, ,251316
2191,Ekta Goshala,"Near River, Jansath, Kamhera, Uttar Pradesh 251314",251314, , ,251316
2192,Gaushala,"FMFM+8X9, Niyazupura, Muzaffarnagar, Uttar Pradesh 251002",251002,, ,251320
2193,Gaushala,"FMFM+8X9, Niyazupura, Muzaffarnagar, Uttar Pradesh 251002",251002,, ,251318
2194,Gaushala sabha,"GAUSHALA MARKET OPPT GARBI SCHOOL, Bhagat Singh Rd, Niyazupura, Muzaffarnagar, Uttar Pradesh 251002",251002,, ,251318
2195,Gaushala Nadi road,"109/35, Gaushala Nadi Rd, Sutharshahi, Muzaffarnagar, Uttar Pradesh 251002",251002,, ,251318
2196,"Gaushala, Atali, Moz, UP","Road, Dholra, Uttar Pradesh 251301",251301,, ,251318
2197,Gaushala of bisht family,"27P5+W7G, Mathkot Khal, Pajyana, Uttarakhand 246428",246428,, ,246428
2198,gaushala Animal Shelter,"samachak, Gausala Rd, Barbigha, Bihar 811101",811101,, ,803101
2199,Govind Shanti gaushala,"5F9H+5WC, Maulanagar, Bihar 803216",803216,, ,803101
2200,Goshala - Ch.Shiva Math,"FCCM+GQV, Medak - Hyderabad Rd, Kukatpally Industrial Estate, Balanagar, Hyderabad, Telangana 500037",500037,, ,500037
2201,Goshala Jeedimetla village,"H-21-62, Sriram Nagar, Jeedimetla, Hyderabad, Telangana 500055",500055,, ,500037
2202,Sri Krishna Goshala,"Power Welfare Society, Narsingi, Kokapet, Hyderabad, Telangana 500075",500075,,1800 4254 6464,500037
2203,Veera Hanuman Ghoshala,"H-21-62, Sriram Nagar, Jeedimetla, Hyderabad, Telangana 500055",500055,, ,500037
2204,Gowshala,"54, 1-2-607, Besides old DBR Mills, 8, Lower Tank Bund St, SBH Officers Colony, Lower Tank Bund, Kavadiguda, Hyderabad, Telangana 500080",500080,,1800 4254 6464,500037
2205,Maissiah Yadav's Goshala,"FC79+JX5, Railway Goods Shed Rd, Janta Nagar, Patel Nagar, Moosapet, Hyderabad, Telangana 500018",500018,, ,500037
2206,Sri Vigneswara Goshala,"FCFC+H7H, beside power nagar park 2, Habeeb Nagar, Moosapet, Hyderabad, Telangana 500018",500018,, ,500037
2207,Gosala - Cow Shelter,"FC3R+666, Shivaji Nagar, Tulasi Nagar, Sanath Nagar, Hyderabad, Telangana 500018",500018,, ,500037
2208,ISKCON VKGT Goshala - Pure Cow Milk,"ISKCON Temple Campus Dabilpur Village, Medchal, Hyderabad, Telangana 501401",501401,http://www.iskconmedchal.org/,096547 89832,500037
2209,Gaushala,"G9FQ+C36, Vasanth Nagar Colony, Nizampet, Hyderabad, Telangana 500090",500090,, ,500037
2210,Sri Krishna Priya Goshala,"CH95+5GV, beside balaji enclave, North Kalyanpuri, Mallikarjuna Nagar, Uppal, Secunderabad, Hyderabad, Telangana 500039",500039,,093469 24787,500037
2211,Goshala - Ch.Shiva Math,"FCCM+GQV, Medak - Hyderabad Rd, Kukatpally Industrial Estate, Balanagar, Hyderabad, Telangana 500037",500037,, ,500103
2212,Gowshala,"54, 1-2-607, Besides old DBR Mills, 8, Lower Tank Bund St, SBH Officers Colony, Lower Tank Bund, Kavadiguda, Hyderabad, Telangana 500080",500080,,1800 4254 6464,500103
2213,Sri Krishna Goshala,"Power Welfare Society, Narsingi, Kokapet, Hyderabad, Telangana 500075",500075,,1800 4254 6464,500103
2214,Hindu seve samithi GOSHALA,"GH6C+W4V, Jawahar Nagar, Sainikpuri, Hyderabad, Secunderabad, Telangana 500094",500094,, ,500103
2215,Goshala - Ch.Shiva Math,"FCCM+GQV, Medak - Hyderabad Rd, Kukatpally Industrial Estate, Balanagar, Hyderabad, Telangana 500037",500037,, ,500042
2216,Sri Krishna Goshala,"Power Welfare Society, Narsingi, Kokapet, Hyderabad, Telangana 500075",500075,,1800 4254 6464,500042
2217,Gowshala,"54, 1-2-607, Besides old DBR Mills, 8, Lower Tank Bund St, SBH Officers Colony, Lower Tank Bund, Kavadiguda, Hyderabad, Telangana 500080",500080,,1800 4254 6464,500042
2218,Sri Krishna Priya Goshala,"CH95+5GV, beside balaji enclave, North Kalyanpuri, Mallikarjuna Nagar, Uppal, Secunderabad, Hyderabad, Telangana 500039",500039,,093469 24787,500042
2219,Gosala - Cow Shelter,"FC3R+666, Shivaji Nagar, Tulasi Nagar, Sanath Nagar, Hyderabad, Telangana 500018",500018,, ,500042
2220,Veera Hanuman Ghoshala,"H-21-62, Sriram Nagar, Jeedimetla, Hyderabad, Telangana 500055",500055,, ,500042
2221,ISKCON VKGT Goshala - Pure Cow Milk,"ISKCON Temple Campus Dabilpur Village, Medchal, Hyderabad, Telangana 501401",501401,http://www.iskconmedchal.org/,096547 89832,500042
2222,Goshala,"Plot No. 111 & 112, North Kalyanpuri, Mallikarjuna Nagar, Uppal, Hyderabad, Telangana 500039",500039,, ,500042
2223,Gaushala,"G9FQ+C36, Vasanth Nagar Colony, Nizampet, Hyderabad, Telangana 500090",500090,, ,500042
2224,"Gowshalla Indiranagar, Dairy Farm Road","31-795, Sai Nagar, Indira Nagar, Bowenpally, Secunderabad, Telangana 500009",500009,, ,500042
2225,Devikanandan Gaushala,"MF3C+GX6, Unnamed Road, Medchal, Secunderabad, Telangana 501401",501401,, ,500042
2226,Gowshala,"54, 1-2-607, Besides old DBR Mills, 8, Lower Tank Bund St, SBH Officers Colony, Lower Tank Bund, Kavadiguda, Hyderabad, Telangana 500080",500080,,1800 4254 6464,500080
2227,Sri Krishna Goshala,"Power Welfare Society, Narsingi, Kokapet, Hyderabad, Telangana 500075",500075,,1800 4254 6464,500080
2228,Sri Krishna Priya Goshala,"CH95+5GV, beside balaji enclave, North Kalyanpuri, Mallikarjuna Nagar, Uppal, Secunderabad, Hyderabad, Telangana 500039",500039,,093469 24787,500080
2229,Veera Hanuman Ghoshala,"H-21-62, Sriram Nagar, Jeedimetla, Hyderabad, Telangana 500055",500055,, ,500080
2230,Gaushala,"G9FQ+C36, Vasanth Nagar Colony, Nizampet, Hyderabad, Telangana 500090",500090,, ,500080
2231,Goshala,"Plot No. 111 & 112, North Kalyanpuri, Mallikarjuna Nagar, Uppal, Hyderabad, Telangana 500039",500039,, ,500080
2232,Bhagyanagar Gouseva Sadan,"CFCP+Q7Q, Bakshiguda, Kavadiguda, Hyderabad, Telangana 500080",500080,, ,500080
2233,Gowshala,"54, 1-2-607, Besides old DBR Mills, 8, Lower Tank Bund St, SBH Officers Colony, Lower Tank Bund, Kavadiguda, Hyderabad, Telangana 500080",500080,,1800 4254 6464,500007
2234,Sri Krishna Priya Goshala,"CH95+5GV, beside balaji enclave, North Kalyanpuri, Mallikarjuna Nagar, Uppal, Secunderabad, Hyderabad, Telangana 500039",500039,,093469 24787,500007
2235,Goshala,"Plot No. 111 & 112, North Kalyanpuri, Mallikarjuna Nagar, Uppal, Hyderabad, Telangana 500039",500039,, ,500007
2236,GAUSHALA PATELNAGAR,"Patel Nagar Rd, Ratan Nagar, Amberpet, Hyderabad, Telangana 500013",500013,,095332 54254,500007
2237,Adiguru Dairy Farms and Gaushala,"4-118/9/1, Dwaraka Nagar, Srinivasa Colony, Boduppal, Hyderabad, Telangana 500092",500092,https://adiguru-dairy-farms-and-gaushala.business.site/,080190 08910,500007
2238,SrimaNarayana goshala -Uppal,"Plot no : 1569, Uppal Bhagayath Rd, Raghavendra Nagar Colony, Gayatri Nagar, Uppal, Hyderabad, Telangana 500039",500039,, ,500007
2239,Sri Krishna Goshala,"Power Welfare Society, Narsingi, Kokapet, Hyderabad, Telangana 500075",500075,,1800 4254 6464,500007
2240,Goshala - Ch.Shiva Math,"FCCM+GQV, Medak - Hyderabad Rd, Kukatpally Industrial Estate, Balanagar, Hyderabad, Telangana 500037",500037,, ,500007
2241,Shri Samarth Kamdhenu Gowshala,"SAMARTHA NARAYAN MAHARAJ ASHRAM, Shivbagh Nagar, MCH Colony, Keshav Swamy Nagar, Hyderabad, Telangana 500006",500006,https://www.narayanaashram.com/page.php?p=donation,092963 58630,500007
