,Name,address,pincode,website,phone number,scrap
1229,Bhagat Singh Gau Seva Dham,"Near, Bhagat Singh Chowk, Shivlok Colony, BHEL Township, Haridwar, Uttarakhand 249407",249407,https://gau-seva-dham.business.site/?utm_source=gmb&utm_medium=referral, ,249205
1230,Ramakrishna Ashram Gaushala,"939J+V8X, Police Officers Colony, Kishanpur, Dehradun, Uttarakhand 248009",248009,, ,249205
1231,Shri Krishna Gaushala,"Near, Road, Bhogpur, Sarangdharwala, Uttarakhand 248143",248143,, ,248145
1232,Shri Ramji Gaushala Bandh Mutthi,"664F+J5P, Ranipokhari, Bangai, Uttarakhand 248145",248145,, ,248145
1233,Ramakrishna Ashram Gaushala,"939J+V8X, Police Officers Colony, Kishanpur, Dehradun, Uttarakhand 248009",248009,, ,248013
1234,Maa dairy.only cow milk.,"Tapovan Enclave, Aamwala, Dehradun, Aamwala Tarla, Uttarakhand 248001",248001,,094109 14837,248013
1235,Shiv Dairy Gaushala,"8X6R+9RH, Rishi Vihar Rd, Majra, Dehradun, Harbanswala, Uttarakhand 248171",248171,,094111 73692,248013
1236,Gaushala Sabha,"VV9H+2JP, BSM College Road, near Kaushik Pathology Clinic, Chow Mandi, Chand Puri Nagar, Roorkee, Uttarakhand 247667",247667,, ,247667
1237,Ram Krishna Gaushala,"VWW9+W57, Bhuryan puram, Bajuhari, Roorkee, Uttarakhand 247667",247667,,098971 57305,247667
1238,Pandi Ji Ki Gaushala,"Pandit Ji Ki Gaushala, Laksar Rd, Kirti Nagar, Dhandera, Roorkee, Uttarakhand 247667",247667,,092591 93824,247667
1239,Shri Gopinath ji Gaushala,"Jhiryan Grunt, Uttarakhand 247667",247667,,080571 97051,247667
1240,गौशाला सभा चाव मण्डी,"purani, Railway Rd, Chow Mandi, Roorkee, Uttarakhand 247667",247667,https://gaushalasbha.blogspot.com/, ,247667
1241,Deep Gaushala dairy farm,"VXMR+5V, Meerpur, near by Patanjali, Sikandarpur, Haridwar, Meerpur Sikandarpur, Uttarakhand 249405",249405,,098773 94870,247667
1242,Gaushala Sabha Regi. Landhaura,"RW7R+GGV, Haridwar, Uttarakhand 247664",247664, , ,247667
1243,Vedic Gosala वैदिक गौशाला गुरूकुल,"Kunja Bahadarpur, Roorkee, Uttarakhand 247667",247667,https://youtube.com/c/VivekAryaVlogs,094115 82292,247667
1244,Shree Vrindavan Gaushala,"2XM9+CGV, Daluwala Mazbata, Daluwala Kalan, Uttarakhand 247667",247667, , ,247667
1245,Shree Gaurksh Nath Gaushala,"RW7R+HG6, Haridwar, Uttarakhand 247664",247664,, ,247667
1246,Gaushala Sabha,"VV9H+2JP, BSM College Road, near Kaushik Pathology Clinic, Chow Mandi, Chand Puri Nagar, Roorkee, Uttarakhand 247667",247667,, ,247661
1247,Vedic Gosala वैदिक गौशाला गुरूकुल,"Kunja Bahadarpur, Roorkee, Uttarakhand 247667",247667,https://youtube.com/c/VivekAryaVlogs,094115 82292,247661
1248,Ram Krishna Gaushala,"VWW9+W57, Bhuryan puram, Bajuhari, Roorkee, Uttarakhand 247667",247667,,098971 57305,247661
1249,Jhiwaredi gaushala,"2RRM+FQ6, Unnamed Road, Khedi Shikohpur, Uttarakhand 247662",247662,, ,247661
1250,Mata Bhagwati Gaushala,"Dev Sanskriti Vishwavidyalaya, Haripur Kalan, Haridwar, Motichur Range, Uttarakhand 249411",249411,http://www.dsvv.ac.in/, ,247661
1251,गौशाला सभा चाव मण्डी,"purani, Railway Rd, Chow Mandi, Roorkee, Uttarakhand 247667",247667,https://gaushalasbha.blogspot.com/, ,247661
1252,Himtech Pharmaceuticals Pvt. Ltd.,"gata no- 212, Khata no- 403, 582, Gher Gaushala, Khedi Shikohpur, Bhagwanpur, Uttarakhand 247661",247661,, ,247661
1253,Shree Brahma Maheshwar Gaushala,"W5M3+V4J, Mayapur, Haridwar, Uttarakhand 249401",249401,, ,247661
1254,Shri Krishna Gaushala,"AshaRam Bapuji ashram, Haripur Kalan, Haridwar, Uttarakhand 249411",249411,, ,247661
1255,Prabhuji Ka Parivaar Gaushala,"WGMM+843, SH 57, Rohit Vihar, Saharanpur, Chiruki, Uttar Pradesh 247001",247001,http://www.facebook.com/prabhujikaparivaar,0132 651 6555,247661
1256,Saptrishi Ashram Gaushala,"X5VV+62W, Haripur Kalan, Haridwar, Motichur Range, Uttarakhand 249411",249411,, ,247661
1257,gaushala dairy,"Sidcul Bypass Rd, near kala gate, Rawali Mahdood, Haridwar, Uttarakhand 249403",249403, , ,247661
1258,Kunaw Gaushala,"376P+Q6Q, Kunaw, Uttarakhand 249304",249304,, ,249204
1259,"Gaushala, Swargashram Trust","48C8+JG9, Swarg Ashram, Rishikesh, Uttarakhand 249304",249304,, ,249204
1260,Lawaris Gayo Ki Panchayati Gaushala,"4876+W73, Near Janki Bridge, Near Beatles' Ashram, Main Street, Ram Jhula, Swarg Ashram, Rishikesh, Uttarakhand 249304",249304,, ,249204
1261,Mata Bhagwati Gaushala,"Dev Sanskriti Vishwavidyalaya, Haripur Kalan, Haridwar, Motichur Range, Uttarakhand 249411",249411,http://www.dsvv.ac.in/, ,249204
1262,Shree Vyas Ashram Goshala,"X6X3+9H8, Unnamed Road, Haripur Kalan, Haridwar, Uttarakhand 249411",249411,, ,249204
1263,Gau Shala Bhagirath Ashram,"48FF+MHJ, Swarg Ashram, Rishikesh, Uttarakhand 249304",249304,, ,249204
1264,वेदलक्षणा गो कृपा नगर श्री पथमेड़ा गोधाम (भगवद धाम गौशाला ),"37, Motichur, Haridwar, Motichur Range, Uttarakhand 246749",246749,, ,249204
1265,Shri Gopinath ji Gaushala,"Jhiryan Grunt, Uttarakhand 247667",247667,,080571 97051,249204
1266,Ramakrishna Ashram Gaushala,"939J+V8X, Police Officers Colony, Kishanpur, Dehradun, Uttarakhand 248009",248009,, ,249204
1267,Gaushala Sabha,"VV9H+2JP, BSM College Road, near Kaushik Pathology Clinic, Chow Mandi, Chand Puri Nagar, Roorkee, Uttarakhand 247667",247667,, ,249204
1268,Saptrishi Ashram Gaushala,"X5VV+62W, Haripur Kalan, Haridwar, Motichur Range, Uttarakhand 249411",249411,, ,249204
1269,Shiv Dairy Gaushala,"8X6R+9RH, Rishi Vihar Rd, Majra, Dehradun, Harbanswala, Uttarakhand 248171",248171,,094111 73692,249204
1270,Ram Krishna Gaushala,"VWW9+W57, Bhuryan puram, Bajuhari, Roorkee, Uttarakhand 247667",247667,,098971 57305,249204
1271,gaushala dairy,"Sidcul Bypass Rd, near kala gate, Rawali Mahdood, Haridwar, Uttarakhand 249403",249403, , ,249204
1272,"Gaushala, Gokulpur","QCMX+V9, Pathar Khurd, Uttar Pradesh 271851",271851,, ,261502
1273,Radha Surabhi Goshala,"GFMV+239, Uttar Pradesh 281504",281504,http://www.radhasurabhi.com/,099276 68182,261502
1274,Gaushala Chhachhrauli,"69X7+5PX, Haryana 135001",135001,, ,261502
1275,"Shri Krishan Gopal Gaushala, Nissing","1, Nissing - Dachar Rd, Nissing, Haryana 132024",132024,,098960 78174,261502
1276,Gaushala Bakhari,"86P3+457, Chandpur, Uttar Pradesh 225305",225305,, ,261502
1277,Smart Gaushala,"WQ79+G3P, Lakhimpur, Baas Khera, Uttar Pradesh 262701",262701,, ,262702
1278,Gaushala,"VVGH+RX4, Gaushala Rd, Kedar Vihar Colony, Balaganj, Lucknow, Uttar Pradesh 226003",226003,, ,226017
1279,Gokuldham gaushala,"356/318/76, Manas Vihar, Alamnagar, Rajajipuram, Lucknow, Uttar Pradesh 226017",226017,"https://www.google.com/travel/hotels/gaushalas%20at%20226017/entity/CgsI6cWChIzXvNv1ARAB/prices?g2lb=4814050,4874190,4893075,4965990,10210223,72277293,72302247,72317059,72406588,72414906,72421566,72462234,72471280,72472051,72473841,72481458,72485658,72486593,72494250,72513513,72536387,72538597,72549171,72570850,72586336,72597757,72597926,72602734,72606236,72608658,72616110,72618893,72619172,72619383,72619935,72620306,72629584&hl=en-IN&gl=in&cs=1&ssta=1&q=gaushalas+at+226017&ts=CAEaKwopEicyJTB4Mzk5YmZmNTM3YzlkZjg0MToweGY1YjZmMmI4YzA4MGEyZTk&rp=OAJAAEgBwAEC&ictx=1&sa=X&ved=2ahUKEwirw5GS-9aGAxVmfGwGHTVyAWgQrK0LegQIERAC", ,226017
1280,Krishna gaushala,"RV93+XJC, Sadrauna Marg, Lucknow, Uttar Pradesh 226009",226009,, ,226017
1281,Rashtriya Gaushala - Gau Ashram,"MRVQ+F44, Memora Chavni, Banthra Sikander Pur, Uttar Pradesh 226401",226401,,094152 29172,226401
1282,"Gir Gau Krishi Jatan Gaushala, Omaxe City Kalli Paschim Lucknow","PWCX+JRR, Kalli Pashchim, Uttar Pradesh 226301",226301,, ,226401
1283,Gaushala,"VVGH+RX4, Gaushala Rd, Kedar Vihar Colony, Balaganj, Lucknow, Uttar Pradesh 226003",226003,, ,226401
1284,Krishna gaushala,"RV93+XJC, Sadrauna Marg, Lucknow, Uttar Pradesh 226009",226009,, ,226401
1285,Shri Gopeshwar Gaushala,"WPG2+GJ6, Malihabad, Uttar Pradesh 226102",226102,, ,226401
1286,Sri Radha Raman Bihari Gaushala,"Unnamed Road, Kursi Rd, in front of Srishti Apartment, Bajrang Vihar, Kalyanpur (West), Atrauli, Lucknow, Uttar Pradesh 226026",226026,, ,226401
1287,Maa Gaushala mohan road,"RP2R+5VW, SH 40, Madarpur, Uttar Pradesh 226013",226013,, ,226401
1288,GauRatna GauShala,"Shivpuri, Road, Kathwara, Uttar Pradesh 226202",226202,https://www.gauratna.org/,080900 81895,226401
1289,Gaushala,"HMC5+728, Lachimanpur, Sitapur, Uttar Pradesh 261001",261001,, ,226401
1290,Gaushala Tanda Kheda,"VM7C+G5R, Malihabad, Goshalalpur, Uttar Pradesh 226102",226102,, ,226401
1291,Jeev aashraya goshala,"QP24+CX, Godoli, Uttar Pradesh 226401",226401,, ,226401
1292,Gaushala,"C 1/3, sulabh awas, Gomti Nagar, Lucknow, Uttar Pradesh 226010",226010,, ,226401
1293,Gokuldham gaushala,"356/318/76, Manas Vihar, Alamnagar, Rajajipuram, Lucknow, Uttar Pradesh 226017",226017,"https://www.google.com/travel/hotels/gaushalas%20at%20226401/entity/CgsI6cWChIzXvNv1ARAB/prices?g2lb=4814050,4874190,4893075,4965990,10210223,72277293,72302247,72317059,72406588,72414906,72421566,72462234,72471280,72472051,72473841,72481458,72485658,72486593,72494250,72513513,72536387,72538597,72549171,72570850,72586336,72597757,72597926,72602734,72606236,72608658,72616110,72618893,72619172,72619383,72619935,72620306,72629584&hl=en-IN&gl=in&cs=1&ssta=1&q=gaushalas+at+226401&ts=CAEaKwopEicyJTB4Mzk5YmZmNTM3YzlkZjg0MToweGY1YjZmMmI4YzA4MGEyZTk&rp=OAJAAEgBwAEC&ictx=1&sa=X&ved=2ahUKEwiiopy4-9aGAxWRSmwGHZr1CcoQrK0LegQIERAC", ,226401
1294,"Gaushala - Jabrauli, Mohanlalganj","JX7G+HC, Jabarauli, Uttar Pradesh 226301",226301, , ,226401
1295,Gaushala Tanda Kheda village,"VM7C+P35, Kakori, Goshalalpur, Uttar Pradesh 226101",226101, , ,226401
1296,Vishwakshena goshaala,"92CQ+865, Pedda Mandadi, Wanaparthy Rd, Raigadda, Wanaparthy, Telangana 509103",509103,, ,509103
1297,VIKHANASA GOSHALA,"Near hanuman temple, NH 44, opposite side bharath dhaba, Amadabakula, Telangana 509381",509381,,094402 10333,509103
1298,Dairy Farm,"9384+G3F, K,D,R Nagar, Wanaparthy, Telangana 509103",509103,,070364 04333,509103
1299,Vikhanasa goshala,"9W2W+V6, Amadabakula, Telangana 509381",509381,, ,509103
1300,Anjanigiri Sri Balaji Go-shala,"1-11, Anjanigiri Gattu, Gattukadipalli - Ganpur Rd, Wanaparthy, Telangana 509380",509380,, ,509103
1301,Shri Darjeeling Siliguri Gaushala,"PC2F+GW4, East Milanpally, Siliguri, West Bengal 734004",734004,, ,734003
1302,Babupara Goshala,"PC2F+9MV, East Milanpally, Babupara, Siliguri, West Bengal 734004",734004,, ,734003
1303,Goushala,"36, 36, Shiv Mandir Rd, Ward 13, Shibrampally, Siliguri, West Bengal 734001",734001,, ,734003
1304,BAJRANG GOSHALA -JADCHERLA BAJRANG GORAKSHA FOUNDATION-TELANGANA,"Bajrang goshala, Sri swami narayan gurukul school, Jadcherla, Telangana 509301",509301,, ,509301
1305,S S S farm Krishnaraj goshala,"R6J3+WX, Kodgal, Telangana 509301",509301,, ,509301
1306,Surabhi Vanam Gaushala,"P77R+VC4, Velugommula, Telangana 509301",509301, , ,509301
1307,SSS FARMS& KRISHNARAJ GOSHALA,"Q47V+6P3, Eerlapally, Badepalle, Telangana 509301",509301,, ,509301
1308,Sant Shri Asharamji Gaushala,"FCGC+6W8, Mauza Ranabhutia, Panchpota, Ranabhutia, West Bengal 700150",700150,, ,700100
1309,Surabhi Goshala,"G7JR+7QJ, Paharpur, Garden Reach, Kolkata, West Bengal 700088",700088,,099276 68182,700100
1310,Calcutta Pinjrapole Society Liluah Gosala,"58, Netaji Subhas Rd, near Gopal wajan kanta, Patuapara, Liluah, Howrah, West Bengal 711204",711204,,033 2268 6451,700100
1311,Gaushala Liluah,"J8GH+9X5, Gaushala, Patuapara, Liluah, Howrah, West Bengal 711203",711203,, ,700100
1312,Kunaw Gaushala,"376P+Q6Q, Kunaw, Uttarakhand 249304",249304,, ,249202
1313,Mata Bhagwati Gaushala,"Dev Sanskriti Vishwavidyalaya, Haripur Kalan, Haridwar, Motichur Range, Uttarakhand 249411",249411,http://www.dsvv.ac.in/, ,249202
1314,Sri Sri Gaushala,"JG6J+3J8, Rajabhat Khawa, West Bengal 735217",735217,, ,736121
1315,Shri Darjeeling Siliguri Gaushala,"PC2F+GW4, East Milanpally, Siliguri, West Bengal 734004",734004,, ,736121
1316,Madan Mohan Goshala Unit of R P Agarwal welfare Trust,"9G8H+55X, Khapaidanga, Sidheswari, West Bengal 736133",736133,, ,736121
1317,Surabhi Goshala,"M3P2+3MW, Unnamed Road, District Jail, Sarangapur, Seripur, Telangana 503001",503001,, ,503224
1318,Sri ramaduta gokul goshala,"P5W9+V69, Singampalle, Telangana 503003",503003,, ,503224
1319,Armoor Post Office,"Q7RH+XX2, Armur, Telangana 503224",503224,http://www.postoffices.co.in/telangana-tg-ts/armoor-nizamabad-24/,1800 11 2011,503224
1320,Sri SmruthiSrinivasa Goshala Sanketh sharma's farm,"4HRW+63C, Bhumpally - Bibipet Rd, Engurthi, Telangana 502102",502102,, ,503111
1321,Dwarkadish Goshala,"95XW+PG, Lingampalle, Telangana 503145",503145,, ,503111
1322,Radhe radhe Go Seva Welfare Society,"JF7H+HXP, x road, Pangadpipri, Telangana 504308",504308,, ,504001
1323,Jai Shree Ram Goshala,"FF2H+F6Q, Boregaon, Telangana 504307",504307,, ,504001
1324,Surabhi Goshala,"M3P2+3MW, Unnamed Road, District Jail, Sarangapur, Seripur, Telangana 503001",503001,, ,504001
1325,Aida Rajesh Goshala Echoda,"FF2H+F9J, Boregaon, Telangana 504307",504307,, ,504001
1326,head post office,"MGCP+MV2, Brahmanwadi, Adilabad, Telangana 504001",504001,http://www.postoffices.co.in/telangana-tg-ts/adilabad-01/,087322 26738,504001
1327,Kamadhenu Gowshala and Foundation,078158 08249, 08249,https://www.kamadhenugowshala.com/,078158 08249,504001
1328,Gowshala,"54, 1-2-607, Besides old DBR Mills, 8, Lower Tank Bund St, SBH Officers Colony, Lower Tank Bund, Kavadiguda, Hyderabad, Telangana 500080",500080,,1800 4254 6464,504001
1329,K K proteins,"Ponnari, road, opp. Goshala, Bhattisavargaon, Telangana 504001",504001,, ,504001
1330,Shri Goshala,"M3GW+H6R, Godown Rd, NRI Colony, Arsapally, Nizamabad, Telangana 503001",503001,, ,503001
1331,Surabhi Goshala,"M3P2+3MW, Unnamed Road, District Jail, Sarangapur, Seripur, Telangana 503001",503001,, ,503001
1332,"C/O Mr Gyaneshwar and Mrs Aruna, Gaushala Chowk","4X2C+M62, Purab Palli Road, Kishanganj, Bihar 733208",733208,, ,733202
1333,Islampur Sub Post Office,"755P+J58, Thana Colony, Khudirampally, Islampur, West Bengal 733202",733202,http://www.indiapost.gov.in/,1800 11 2011,733202
1334,Goshala Sri Krishna temple,"J4JJ+HQX, East Netaji Pally, Raiganj, West Bengal 733134",733134,, ,733128
1335,Goshala,"J4JJ+PPQ, SH 10A, East Netaji Pally, Raiganj, West Bengal 733134",733134, , ,733128
1336,Goshala Bazaar,"near Siliguri More, 733134, Pakamba, Bahin, Raiganj, West Bengal 733134",733134, , ,733128
1337,Goshala,"76-8-6/3, Swathi Theatre Rd, opp. andhra bank, Housing Board Colony, Vijayawada, Andhra Pradesh 520012",520012,, ,522503
1338,Murali Goshala,"CF95+7HX, Tadikonda, Andhra Pradesh 522236",522236,, ,522503
1339,SKBG Sri Krishna Balarama Goushala,"Gomata Land Karakatta Down, One Center, Gollapudi, Vijayawada, Andhra Pradesh 521225",521225,, ,522503
1340,Temple Goshala,"Swamy Konda Front, Mandalam, Yanamalakuduru, Ramalingeswara Nagar, Penamaluru, Vijayawada, Andhra Pradesh 520007",520007,, ,522503
1341,Shri Kashi Vishwanatha Goseva Gosamrakshana Sangam,"Guntur - Vijayawada Hwy, Pedakakani, Namburu, Andhra Pradesh 522509",522509,,098666 58507,522503
1342,Sri Krishna Ananda Ashram,"FH4F+F7X, Yerrabalam Road, Mangalagiri, Andhra Pradesh 522503",522503,,086452 31314,522503
1343,Amaravati Goshala,"Madala (post), Muppalla, Guntur, Andhra Pradesh 522403",522403, , ,522503
1344,Gopala Krishna GoShala,"534411, Unnamed, Chikili, Andhra Pradesh 761106",761106,,094404 87864,522503
1345,Mangalagiri Post Office 522503,"CHJ8+C9F, Mangalagiri, Andhra Pradesh 522503",522503,,1800 11 2011,522503
1346,Bhagwan Mahaveer Goushala,"FH5C+8X4, Yerrabalem Road, Industrial Estate, Yerrabalem, Andhra Pradesh 522503",522503, , ,522503
1347,Smart Gaushala,"WQ79+G3P, Lakhimpur, Baas Khera, Uttar Pradesh 262701",262701,, ,262721
1348,Smart Gaushala,"WQ79+G3P, Lakhimpur, Baas Khera, Uttar Pradesh 262701",262701,, ,261506
1349,Ghuru Kripa Goshala,"VHX6+W4V, Keelamangalam, Gowripatti, Tamil Nadu 630558",630558,, ,630556
1350,Sri Laxmi-Narsingha Goshala,"9CPV+H8P, Nrisingha Palli, SH 8, Krishnanagar, Subarna Behar, West Bengal 741103",741103,https://scsmathworldwide.com/goshala.html, ,741103
1351,Mayapur Goshala,"C9CV+93G, Mayapur, West Bengal 741302",741302,https://www.mayapur.com/visit-mayapur/places-to-visit/goshala/,1800 212 1655,741103
1352,SHYAMDAS MAHARAJ GOSHALA,"CC7J+7HV, Subarna Behar, West Bengal 741315",741315,, ,741103
1353,Surovi Goshala,"QGG6+5GQ, Golabari - Nilganj Rd, Santoshpur, West Bengal 743248",743248,, ,700124
1354,"Sri Parashar Nath Rishkul Bramhcharya Ashram Evam Gaushala,","P88R+4VC, Madhiya Ghat Rd, Naya Gaon, Maigalganj, Uttar Pradesh 261505",261505,, ,261505
1355,Shri Shyam ji Gaushala Loikheda,"RXH8+Q57, Ramapur, Ramapur Varkatpur, Uttar Pradesh 261505",261505,, ,261505
1356,Radha Surabhi Goshala,"GFMV+239, Uttar Pradesh 281504",281504,http://www.radhasurabhi.com/,099276 68182,261505
1357,"GAUSHALA GAUHANIYA गौशाला गौहनियाँ, रामप्रताप, राजाराम","JV4Q+H3, Hardaspur, Uttar Pradesh 241124",241124,, ,261505
1358,Maharshi Goshala Registered Office,"XHX3+VW5, SV Arcade, Hyderabad - Warangal Highway, Nakkala Gutta, Hanamkonda, Telangana 506001",506001,, ,506001
1359,goshala,"XH7R+99P, Bommala Gudi Rd, Kareemabad, Warangal, Telangana 506002",506002,, ,506001
1360,Maharshi Goshala Farm,"2GXF+8RR, Beside BGR Garden,Chinthagattu(V Hasanparthy(M), Warangal Urban, Telangana 506015",506015,http://www.maharshigoshala.in/,098490 10403,506001
1361,Maharshi Goshala Charitable Trust,"Warangal, Chinthagattu, Telangana 506015",506015,http://www.maharshigoshala.in/,098490 10403,506001
1362,Goshala Yadagirigutta,"HWQX+QH3, Gandhi Nagar, Yadagirigutta, Telangana 508115",508115,, ,508116
1363,Govind Gaushala,"HRPG+VR, Palle Pahad, Telangana 508116",508116,, ,508116
1364,Shri Hanuman goshala,"Siyora feild Fakeer gudem, Telangana 508116",508116,, ,508116
1365,Goshala,"GMJQ+9WV, Keesaragutta, Telangana 501301",501301,, ,508116
1366,sahayog Goshala,"MWJ6+JW, Challur, Telangana 508105",508105, , ,508116
1367,Pillaipalli Saptaparni Gowshala,"9P8P+5G5, Nalgonda, Telangana 508284",508284,,094910 30505,508116
1368,Rakshitha Goshala,"CMWP+9G3, Behind Venkateshwara Swamy Temple, Yamnampet, Ghatkesar, Hyderabad, Telangana 501301",501301, , ,508116
1369,Sri Krishna Priya Goshala,"CH95+5GV, beside balaji enclave, North Kalyanpuri, Mallikarjuna Nagar, Uppal, Secunderabad, Hyderabad, Telangana 500039",500039,,093469 24787,508116
1370,Eskay Goshala & Natural Farming,"Indiranagar Colony, Aushapur, Ghatkesar, Telangana 501301",501301,, ,508116
1371,Kedareshwara goshala,"9P46+WVQ, Saddupally, Telangana 501505",501505, , ,508116
1372,Lakshmi goshala,"Chiryala Village, Secunderabad, Telangana 501301",501301,, ,508116
1373,NG Goshala,"JXMM+H6P, Yadagirigutta, Telangana 508115",508115,, ,508116
1374,Shri Samarth Kamdhenu Gowshala,"SAMARTHA NARAYAN MAHARAJ ASHRAM, Shivbagh Nagar, MCH Colony, Keshav Swamy Nagar, Hyderabad, Telangana 500006",500006,https://www.narayanaashram.com/page.php?p=donation,092963 58630,508116
1375,Gayitri Gokulam,"VF7W+J94, Islampur, Telangana 502335",502335,https://www.facebook.com/gayitrigokulam/, ,508116
1376,Gopthri Desi Goshala,"FMM7+PV2, Bandlaguda, Secunderabad, Telangana 501301",501301,, ,508116
1377,Sriman Narayana Goshala,"Sln Colony, 7-233/1, LIG Road, Annojiguda, kv, Secunderabad, Telangana 501301",501301,, ,508116
1378,AmritaVarshini Goushala,"7HRM+X47, Central Avenue Road, opp. 22 Cross Street, Roopa Nagar, Mysuru, Karnataka 570026",570026,, ,570005
1379,Goshala,"Goshala Rd, Ferns City, Garudachar Palya, Mahadevapura, Bengaluru, Karnataka 560048",560048,, ,570005
1380,"District Govt Goshala ಜಿಲ್ಲಾ ಸರ್ಕಾರಿ ಗೋಶಾಲೆ, ಮೈಸೂರು","5PW8+4Q6, Basahallihundi, Karnataka 571311",571311,, ,570005
1381,Goshala,"22, Paramahamsa Rd, Gokulam 4th Stage, Gokulam, Mysuru, Karnataka 570020",570020, , ,570005
1382,Maharshi Goshala Registered Office,"XHX3+VW5, SV Arcade, Hyderabad - Warangal Highway, Nakkala Gutta, Hanamkonda, Telangana 506001",506001,, ,506004
1383,Venu Dairy Farm Goshala,"WJVQ+VH4, Sthambampally, Telangana 506004",506004,, ,506004
1384,Maharshi Goshala Charitable Trust,"Warangal, Chinthagattu, Telangana 506015",506015,http://www.maharshigoshala.in/,098490 10403,506004
1385,Nrusimha Vanam and Goshala,"Q7FF+GGM, Service Rd, Visakhapatnam, Andhra Pradesh 530040",530040,, ,530008
1386,Simhachalam Devasthanam Goshala,"Q7FF+R9P, Simhachalam to Hanumanthavaka Jn BRTS Rd, Visakhapatnam, Andhra Pradesh 530040",530040,, ,530008
1387,Gaushala Upeda,"PVPW+2HV, Upeda, Uttar Pradesh 245201",245201,, ,245208
1388,"Madhusudan Gaushala, Chandyana मधुसूदन गौशाला, चन्दियाना","Bugrasi - Chandyana Rd, Uttar Pradesh 203403",203403,, ,245208
1389,Hare Krishna Farms - Kanhaiya Goshala,"P8PC+6CM Kanhaiya Goshala, Loni Bhopura Rd, Banthla, Ghaziabad, Uttar Pradesh 201102",201102,, ,245208
1390,Shri Ramkrishan Gaushala,"MWPF+VVX, Devi Colony, Bahadurgarh, Haryana 124507",124507,, ,245208
1391,Bharat Gaushala,"Kanawani Village, Indirapuram, Ghaziabad, Uttar Pradesh 201014",201014,,079825 12934,245208
1392,Shri Krishna Gaushala,"M9XR+6M4, Indraprastha Marg, Ghaziabad, Uttar Pradesh 201004",201004,, ,245208
1393,Lakshmi Narayan Gaushala,"G4HV+7GV, Narsena, Yunispur, Uttar Pradesh 203398",203398,, ,245208
1394,Nandi Dham Gaushala,"F2WF+F4H, Carterpuri Rd, Ashok Vihar Phase III Extension, Gurugram, Haryana 122001",122001,, ,245208
1395,Shri Ram Gaushala ghaziabad,"Shiv aaradhna samiti Shiv chandi mandir, Block A, Lohia Nagar, Ghaziabad, Uttar Pradesh 201001",201001,http://www.shriramgaushala.com/,085880 90318,245208
1396,PARTAPUR Gaushala,"WJFP+R97, Unnamed Road, Partapur, Meerut, Uttar Pradesh 250103",250103,, ,245208
1397,Soul Sadhna Kendra,"M5PP+R4P, SOUL Sadhna Kendra, Ramnish Ji Gaushala, Pooth Bangar, on Bak of Ganga, Garh Mukteshwar",eshwar,, ,245208
1398,Krishna Gaushala,"P7RC+F53, Ankur Vihar, Ved Vihar, Ghaziabad, Uttar Pradesh 201102",201102,, ,245208
1399,Nandini Gaushala (Gir Cow A2 Milk),"X/1464, Street No. 4, Rajgarh Colony, Delhi, 110031",110031,https://www.facebook.com/A2milkdelhi/, ,245208
1400,Shri shiv gaushala,"19, Meerut Rd, Industrial Area, Meerut Road Industrial Area, Ghaziabad, Uttar Pradesh 201003",201003,, ,245208
1401,Grameen Gaushala,"Q2VP+86R, North, Ishwar Colony, Bawana, New Delhi, Delhi, 110039",110039,,098106 55834,245208
1402,Gaudham gaushala,"XJ94+7CV, Panchli Khurd, Uttar Pradesh 250502",250502,, ,245208
1403,Shri Panchayati Gaushala,"245101, Shankar Ganj, Bhagwanpuri, kavi Nagar, Hapur, Uttar Pradesh 245101",245101, , ,245208
1404,Shyam Nandini Gaushala,"Q3RH+FVR, Village Rampur Nyamatpur, Mela Road, Garh Mukteshwar, Uttar Pradesh 245205",245205,http://www.prernasewa.org/, ,245208
1405,Shri Madhave Gaushala Asoura,"Ankur Tyagi house.745, Asaura, Uttar Pradesh 245101",245101, , ,245208
1406,Khodiyar gaushala,"Satya Residency, 32, Chandlodiya, Ahmedabad, Gujarat 382481",382481, , ,380019
1407,Bansi Gir Gaushala,"Bansi Gir Gaushala Behind metro whole sale mall S.P. Ring Road, Shantipura Cir, Ahmedabad, Gujarat 382210",382210,http://www.bansigir.in/,063519 78087,380019
1408,Sahajanand Gaushala,"9-10, Jahangirpura, Asarwa, Ahmedabad, Gujarat 380016",380016, , ,380019
1409,Revakant gir gaushala,"Lilapur, Gujarat 380060",380060,,094082 03447,380019
1410,MENAJIVI GAUSHALA CHERITABLE SANSTHAN,"At Post 402, Aakruti Complex, Stadium Circle, Navarangpura Gam, Navrangpura, Ahmedabad, Gujarat 380009",380009,http://www.menajivigaushala.com/,095553 64320,380019
1411,Krishna Gir Farm,"Service Rd, Bopal, Ahmedabad, Gujarat 380058",380058,,081538 10007,380019
1412,Radhe Gaushala,"Vatva Gamdi Road, Near Shakti Gardenia flats, Near, Sardar Patel Ring Rd, Ahmedabad, Gujarat 382440",382440,, ,380019
1413,Vijya Gaushala,"2FH2+622, Ghuma, Ahmedabad, Gujarat 380058",380058,, ,380019
1414,Shaligram Bagh,"5F4V+R2V, Near Narmada Canal, Near Dantali Industrial Estate, Gota-Vadsar Road, Vadsar, Dantali, Gujarat 382165",382165,, ,380019
1415,Sabarmati Ashram Gaushala Staff Quarters,"3H6J+F87, Near Ashram Road, Ashram Rd, Hridaya Kunj, Gandhi Ashram, Ahmedabad, Gujarat 380027",380027,http://www.sagbidaj.org/, ,380027
1416,SAG,"Gaushala, Sabarmati Ashram, Ahmedabad, Gujarat 380005",380005,http://www.sagbidaj.org/,079 2755 7620,380027
1417,Bansi Gir Gaushala,"Bansi Gir Gaushala Behind metro whole sale mall S.P. Ring Road, Shantipura Cir, Ahmedabad, Gujarat 382210",382210,http://www.bansigir.in/,063519 78087,380027
1418,MENAJIVI GAUSHALA CHERITABLE SANSTHAN,"At Post 402, Aakruti Complex, Stadium Circle, Navarangpura Gam, Navrangpura, Ahmedabad, Gujarat 380009",380009,http://www.menajivigaushala.com/,095553 64320,380027
1419,Revakant gir gaushala,"Lilapur, Gujarat 380060",380060,,094082 03447,380027
1420,Krishna Gir Farm,"Service Rd, Bopal, Ahmedabad, Gujarat 380058",380058,,081538 10007,380027
1421,Shaligram Bagh,"5F4V+R2V, Near Narmada Canal, Near Dantali Industrial Estate, Gota-Vadsar Road, Vadsar, Dantali, Gujarat 382165",382165,, ,380027
1422,Saibaba Gaushala,"2GXF+RC5, Jai Ambe Nagar, Thaltej, Ahmedabad, Gujarat 380054",380054,, ,380027
1423,Sahajanand Gaushala,"9-10, Jahangirpura, Asarwa, Ahmedabad, Gujarat 380016",380016, , ,380027
1424,Gaukunj Gir Gaushala,"Gaukunj Gir Gaushala B/h Motera Gam Nr, Purshotam Heritage, Motera, Sabarmati, Ahmedabad, Gujarat 380005",380005,,090814 11182,380005
1425,SAG,"Gaushala, Sabarmati Ashram, Ahmedabad, Gujarat 380005",380005,http://www.sagbidaj.org/,079 2755 7620,380005
1426,Sabarmati Ashram Gaushala Staff Quarters,"3H6J+F87, Near Ashram Road, Ashram Rd, Hridaya Kunj, Gandhi Ashram, Ahmedabad, Gujarat 380027",380027,http://www.sagbidaj.org/, ,380005
1427,Ashram Gaushala,"4J33+X52, Motera, Ahmedabad, Gujarat 382424",382424,https://ashram.org/gaushala/, ,380005
1428,Sahajanand Gaushala,"9-10, Jahangirpura, Asarwa, Ahmedabad, Gujarat 380016",380016, , ,380005
